"user_id","status_id","created_at","screen_name","text","source","display_text_width","reply_to_status_id","reply_to_user_id","reply_to_screen_name","is_quote","is_retweet","favorite_count","retweet_count","quote_count","reply_count","hashtags","symbols","urls_url","urls_t.co","urls_expanded_url","media_url","media_t.co","media_expanded_url","media_type","ext_media_url","ext_media_t.co","ext_media_expanded_url","ext_media_type","mentions_user_id","mentions_screen_name","lang","quoted_status_id","quoted_text","quoted_created_at","quoted_source","quoted_favorite_count","quoted_retweet_count","quoted_user_id","quoted_screen_name","quoted_name","quoted_followers_count","quoted_friends_count","quoted_statuses_count","quoted_location","quoted_description","quoted_verified","retweet_status_id","retweet_text","retweet_created_at","retweet_source","retweet_favorite_count","retweet_retweet_count","retweet_user_id","retweet_screen_name","retweet_name","retweet_followers_count","retweet_friends_count","retweet_statuses_count","retweet_location","retweet_description","retweet_verified","place_url","place_name","place_full_name","place_type","country","country_code","geo_coords","coords_coords","bbox_coords","status_url","name","location","description","url","protected","followers_count","friends_count","listed_count","statuses_count","favourites_count","account_created_at","verified","profile_url","profile_expanded_url","account_lang","profile_banner_url","profile_background_url","profile_image_url"
"x1434230225961902081","x1437796985721995264",2021-09-14 15:14:49,"TheRealDemokrat","Wäre witzig, wenn #Baerbock Inlandsflüge verbietet und Tempolimit 130 km/h einführt, aber sie bei einem Inlandsflug oder bei überhöhter Geschwindigkeit stirbt. Achtung #Sarkasmus #NiemalsGruen #Mordaufruf #SchwarzerHumor #Triell #btw21","Twitter Web App",235,,,,FALSE,FALSE,0,0,,,"Baerbock Sarkasmus NiemalsGruen Mordaufruf SchwarzerHumor Triell btw21",,,,,,,,,,,,,,,"de",,,,,,,,,,,,,,,,,,,,,,,,,,,,,,,,,,,,,"NA NA","NA NA","NA NA NA NA NA NA NA NA","https://twitter.com/TheRealDemokrat/status/1437796985721995264","MissionBorkenkäfer","Deutschland","Jedes Lebewesen hat es verdient zu Leben, daher züchten wir u.a. Borkenkäfer und setzen diese aus.

Für mehr Erderwärmung und weniger Glätte Opfer im Winter !!",,FALSE,4,2,0,94,40,2021-09-04 19:01:57,FALSE,,,,"https://pbs.twimg.com/profile_banners/1434230225961902081/1630859091",,"http://pbs.twimg.com/profile_images/1434230270018850820/pnNGCzNp_normal.png"
"x1686084000","x1437796743291228164",2021-09-14 15:13:51,"glueckundgeld","@IgorMatviyets @9Initiative @c_bernstiel This. <U+0001F446> Allerdings hat sich @ABaerbock im #Triell #Halle und #Hanau durcheinander gebracht.","Twitter for Android",91,"x1437748768150102020","x1371005676","IgorMatviyets",FALSE,FALSE,0,0,,,"Triell Halle Hanau",,,,,,,,,,,,,"x1371005676 x1282968095188033537 x830085678063030273 x2179010672","IgorMatviyets 9Initiative c_bernstiel ABaerbock","de",,,,,,,,,,,,,,,,,,,,,,,,,,,,,,,,,,,,,"NA NA","NA NA","NA NA NA NA NA NA NA NA","https://twitter.com/glueckundgeld/status/1437796743291228164","Spacedog*","berlin/leipzig","radical democrat. antifascist. historian with <U+2764><U+FE0F> for #python, #bikes & lem. macht irgendwas mit politik.",,FALSE,450,1020,2,3173,1125,2013-08-20 15:56:58,FALSE,,,,"https://pbs.twimg.com/profile_banners/1686084000/1377196311","http://abs.twimg.com/images/themes/theme1/bg.png","http://pbs.twimg.com/profile_images/702491138964504576/ujIkneoV_normal.jpg"
"x64642542","x1437796596293455877",2021-09-14 15:13:16,"StefanHanauska","#Triell hin oder her - jetzt stellt euch doch mal ernsthaft vor, der #Rheinlandtrump wäre Bundeskanzler...","Twitter Web App",106,,,,FALSE,FALSE,0,0,,,"Triell Rheinlandtrump",,,,,,,,,,,,,,,"de",,,,,,,,,,,,,,,,,,,,,,,,,,,,,,,,,,,,,"NA NA","NA NA","NA NA NA NA NA NA NA NA","https://twitter.com/StefanHanauska/status/1437796596293455877","Stefan Hanauska","","Rein privater Account, rein private Meinung.
#twlz #bayernedu #mebis #moodle",,FALSE,955,824,16,6654,10917,2009-08-11 06:09:27,FALSE,,,,"https://pbs.twimg.com/profile_banners/64642542/1570260007","http://abs.twimg.com/images/themes/theme1/bg.png","http://pbs.twimg.com/profile_images/1180381342397341696/XCS1AmDy_normal.jpg"
"x1494316488","x1437796457663324165",2021-09-14 15:12:43,"Katharsis939","@AlexWeigand Den letzten Wahlergebnissen gegenübergestellt, hat sich ne Menge getan und die CDU scheint zu wackeln. Sofern man sich die 50 Cent für seine Stimmabgabe in der Fuldaer Zeitung leisten möchte. (Mobilfunkpreise können abweichen)
#Triell https://t.co/oQdDay7IRA","Twitter Web App",234,"x1437703374212943874","x2846900717","AlexWeigand",FALSE,FALSE,0,0,,,"Triell",,,,,"http://pbs.twimg.com/media/E_QTxrtXEA4-wXu.png","https://t.co/oQdDay7IRA","https://twitter.com/Katharsis939/status/1437796457663324165/photo/1","photo","http://pbs.twimg.com/media/E_QTxrtXEA4-wXu.png","https://t.co/oQdDay7IRA","https://twitter.com/Katharsis939/status/1437796457663324165/photo/1",,"x2846900717","AlexWeigand","de",,,,,,,,,,,,,,,,,,,,,,,,,,,,,,,,,,,,,"NA NA","NA NA","NA NA NA NA NA NA NA NA","https://twitter.com/Katharsis939/status/1437796457663324165","Katharsis - HÄNDE WASCHEN!","O-Saft Farm","Viel Animespam, wenig Mehrwert
Like = Endorsement",,FALSE,159,26,29,24234,14989,2013-06-09 01:15:06,FALSE,,,,"https://pbs.twimg.com/profile_banners/1494316488/1421607486","http://abs.twimg.com/images/themes/theme14/bg.gif","http://pbs.twimg.com/profile_images/1390955888698171399/d9Wso83b_normal.jpg"
"x1083691625950441472","x1437796315954663425",2021-09-14 15:12:09,"ntvpodcast",".@vm_dittrich
und Hausmeister Ronny analysieren in der neuen Folge #DittDattDittrich das #Triell. Sollte das nächste vielleicht mal von Dieter Bohlen moderiert werden? <U+0001F937><U+200D><U+2640><U+FE0F> 
https://t.co/wKqyOS430T","TweetDeck",197,,,,FALSE,FALSE,1,1,,,"DittDattDittrich Triell",,"n-tv.de/leute/Baerbock…","https://t.co/wKqyOS430T","https://www.n-tv.de/leute/Baerbock-Bohlen-und-ein-besoffener-Bond-article22801475.html",,,,,,,,,"x116290602","vm_dittrich","de",,,,,,,,,,,,,,,,,,,,,,,,,,,,,,,,,,,,,"NA NA","NA NA","NA NA NA NA NA NA NA NA","https://twitter.com/ntvpodcast/status/1437796315954663425","Podcasts bei ntv","In der Podcast-App ihrer Wahl","Nachrichten: @ntvde | Breaking News: @ntv_EIL | Noch mehr vom #Nachrichtensender: @ntvde_politik, @teleboerse, @ntvde_sport |
https://t.co/WVdBqQimlD","https://t.co/s3ICcEPtOR",FALSE,594,189,1,693,90,2019-01-11 11:46:32,FALSE,"https://t.co/s3ICcEPtOR","http://ntv.de/mediathek/audio/",,"https://pbs.twimg.com/profile_banners/1083691625950441472/1564584729","http://abs.twimg.com/images/themes/theme1/bg.png","http://pbs.twimg.com/profile_images/1083710327597031424/Hj2BDZc3_normal.jpg"
"x1238911708212666372","x1437796134609694724",2021-09-14 15:11:26,"Fu_Schneider","@GreenFranzi Völlig zu Recht! Danke #Laschet 
#CDU bei #Triell 

@derspiegel https://t.co/PqNkuWX6gC","Twitter for Android",63,"x1437790657171578880","x1971150385","GreenFranzi",FALSE,FALSE,0,0,,,"Laschet CDU Triell",,,,,"http://pbs.twimg.com/media/E_QT9vSX0AIKPMP.jpg","https://t.co/PqNkuWX6gC","https://twitter.com/Fu_Schneider/status/1437796134609694724/photo/1","photo","http://pbs.twimg.com/media/E_QT9vSX0AIKPMP.jpg","https://t.co/PqNkuWX6gC","https://twitter.com/Fu_Schneider/status/1437796134609694724/photo/1",,"x1971150385 x2834511","GreenFranzi derspiegel","de",,,,,,,,,,,,,,,,,,,,,,,,,,,,,,,,,,,,,"NA NA","NA NA","NA NA NA NA NA NA NA NA","https://twitter.com/Fu_Schneider/status/1437796134609694724","Schneider","Europe","#Demokratie/ #Freiheitsrechte / #Grundrechte /#Liberal",,FALSE,183,825,2,5765,3571,2020-03-14 19:36:40,FALSE,,,,,,"http://pbs.twimg.com/profile_images/1238912439598669828/4PyJUVe8_normal.jpg"
"x2365843422","x1437795660363862023",2021-09-14 15:09:33,"GregorHans_Now","Neonazismus ist offenbar Teil der gesamten Bandbreite der #CDU. #Triell #btw21 #Maaßen #CDUrausausderRegierung https://t.co/uWMU7tyj5K","Twitter Web App",110,,,,TRUE,FALSE,0,0,,,"CDU Triell btw21 Maaßen CDUrausausderRegierung",,"twitter.com/SPIEGELTV/stat…","https://t.co/uWMU7tyj5K","https://twitter.com/SPIEGELTV/status/1437753764933406722",,,,,,,,,,,"de","x1437753764933406722","Hans-Georg #Maaßen, ein Gastwirt, die Presse und der Neo-Nazi Tommy #Frenck. Hier die ganze #SPIEGELTV -Reportage: https://t.co/Ym2u0DvagC https://t.co/gVDjO1WHWF",2021-09-14 12:23:04,"TweetDeck",2309,680,"x18026976","SPIEGELTV","SPIEGEL TV",81155,944,19369,"Hamburg, Germany","Zeigen, was ist: Dokus und Reportagen von SPIEGEL TV.",TRUE,,,,,,,,,,,,,,,,,,,,,,"NA NA","NA NA","NA NA NA NA NA NA NA NA","https://twitter.com/GregorHans_Now/status/1437795660363862023","Robert","","Feminist, Cinephilist. All people are equal.
SPD, Jusos, DL21.
Klima, Verteilungsgerechtigkeit.
#Vote #r2g @#btw21.

https://t.co/52qju1chWQ…",,FALSE,469,688,21,28271,18605,2014-02-28 16:33:15,FALSE,,,,"https://pbs.twimg.com/profile_banners/2365843422/1462998606","http://abs.twimg.com/images/themes/theme1/bg.png","http://pbs.twimg.com/profile_images/1382335436786393094/PXBMx-WZ_normal.jpg"
"x26458162","x1437794939795124233",2021-09-14 15:06:41,"spdde","Schaut gerne in den Artikel von @derspiegel über den Faktencheck zum #Triell. Eins verraten wir euch aber schon vorab: @OlafScholz fokussierte sich auf die Fakten. Hier geht es zum Artikel: <U+0001F447>
https://t.co/PBUKSnBOrq","Twitter Web App",215,,,,FALSE,FALSE,16,2,,,"Triell",,"spiegel.de/politik/deutsc…","https://t.co/PBUKSnBOrq","https://www.spiegel.de/politik/deutschland/bei-welchen-themen-baerbock-laschet-und-scholz-von-den-fakten-abwichen-a-f5ccbc38-d32e-4c94-be4c-abe50b6bda77",,,,,,,,,"x2834511 x38150247","derspiegel OlafScholz","de",,,,,,,,,,,,,,,,,,,,,,,,,,,,,,,,,,,,,"NA NA","NA NA","NA NA NA NA NA NA NA NA","https://twitter.com/spdde/status/1437794939795124233","SPD Parteivorstand <U+0001F1EA><U+0001F1FA>","www.spd.de","Tweets aus der Parteizentrale der #SPD. Auf spd.de gibt's alles rund um sozialdemokratische Politik. Schaut vorbei!","https://t.co/2v9OtaMpl1",FALSE,400150,4182,2240,54029,35770,2009-03-25 08:41:02,TRUE,"https://t.co/2v9OtaMpl1","https://www.spd.de/site/impressum/",,"https://pbs.twimg.com/profile_banners/26458162/1631518313","http://abs.twimg.com/images/themes/theme1/bg.png","http://pbs.twimg.com/profile_images/1291714592578703361/Y54qpaxG_normal.jpg"
"x1178752734285180929","x1437794906999869450",2021-09-14 15:06:33,"monografisch","@kaydee_de Triell, als ein Scheinwerfer umfiel, sagte A.B.:“Hoppsala.“
Das ist alles.","Twitter for iPhone",74,"x1437794459975041026","x14314942","kaydee_de",FALSE,FALSE,0,0,,,,,,,,,,,,,,,,"x14314942","kaydee_de","de",,,,,,,,,,,,,,,,,,,,,,,,,,,,,,,,,,,,,"NA NA","NA NA","NA NA NA NA NA NA NA NA","https://twitter.com/monografisch/status/1437794906999869450","monografisch","Berlin, Deutschland","Eat, drink, love / Leichtigkeit / ganz oder gar nicht / Zeitmomentesammelklammer / #Grafik #Cello #12uhrmittags #laufen",,FALSE,188,366,1,1000,5827,2019-09-30 19:25:41,FALSE,,,,"https://pbs.twimg.com/profile_banners/1178752734285180929/1622266701",,"http://pbs.twimg.com/profile_images/1432257781923450882/MkOR7eUD_normal.jpg"
"x1093905966662406144","x1437794656583098370",2021-09-14 15:05:33,"yankiffm","zunehmende Verbote und mehr staatliche Regulierungen schränkt viele Menschen in ihrer Freiheit ein.

Wir brauchen Innovationen statt Verbote, dass erreichen wir durch Bürokratieabbau, Steuererleichterung, harter Co2-Deckel, Forschung, Technologieoffenheit u.v.m. 

#Triell https://t.co/zdz2OceqNp","Twitter for iPhone",272,,,,FALSE,FALSE,0,0,,,"Triell",,,,,"http://pbs.twimg.com/media/E_QSnfgWQAkmzzS.jpg","https://t.co/zdz2OceqNp","https://twitter.com/yankiffm/status/1437794656583098370/photo/1","photo","http://pbs.twimg.com/media/E_QSnfgWQAkmzzS.jpg","https://t.co/zdz2OceqNp","https://twitter.com/yankiffm/status/1437794656583098370/photo/1",,,,"de",,,,,,,,,,,,,,,,,,,,,,,,,,,,,,,,,,,,,"NA NA","NA NA","NA NA NA NA NA NA NA NA","https://twitter.com/yankiffm/status/1437794656583098370","Yanki Pürsün MdL","Frankfurt am Main, Deutschland","Abgeordneter für Hessen | Fraktionsvorsitzender FDP-Fraktion im Römer | Sprecher für Gesundheit & Soziales | Luftverkehrskaufmann | Wahlbeobachter","https://t.co/jHNObg8FG8",FALSE,488,528,28,824,2276,2019-02-08 16:14:41,FALSE,"https://t.co/jHNObg8FG8","http://xn--prsn-0rac.de/",,"https://pbs.twimg.com/profile_banners/1093905966662406144/1616514864",,"http://pbs.twimg.com/profile_images/1234832588335910913/FLV8O56__normal.jpg"
"x1106380064","x1437794653940633603",2021-09-14 15:05:33,"KaiKochmann","#triell Die Untersuchungen der ""Osnabrücker Behörde"", von der @OlafScholz neulich sprach, waren erst der Anfang: Staatsanwaltschaft ermittelt gegen Olaf Scholz' Staatssekretär https://t.co/wAx7fTpPgB via @derspiegel","Twitter for iPhone",215,,,,FALSE,FALSE,0,0,,,"triell",,"spiegel.de/politik/deutsc…","https://t.co/wAx7fTpPgB","https://www.spiegel.de/politik/deutschland/staatsanwaltschaft-ermittelt-gegen-olaf-scholz-staatssekretaer-wolfgang-schmidt-a-cd4c2cbc-4d19-4e9f-bbb3-09e7cb5d9acf",,,,,,,,,"x38150247 x2834511","OlafScholz derspiegel","de",,,,,,,,,,,,,,,,,,,,,,,,,,,,,,,,,,,,,"NA NA","NA NA","NA NA NA NA NA NA NA NA","https://twitter.com/KaiKochmann/status/1437794653940633603","Kai Kochmann <U+0001F1EA><U+0001F1FA><U+0001F1F8><U+0001F1FB><U+0001F1E9><U+0001F1EA>","Berlin","Coach, Karriereberater, Image-Mentor, Freigeist und Freund der selbstbestimmten Lebensführung in fairem Miteinander.","https://t.co/klFDabNu8P",FALSE,1151,969,107,13144,20714,2013-01-20 14:29:19,FALSE,"https://t.co/klFDabNu8P","http://www.polithos.de",,"https://pbs.twimg.com/profile_banners/1106380064/1596706912","http://abs.twimg.com/images/themes/theme1/bg.png","http://pbs.twimg.com/profile_images/1291303497808453633/D2OIsvgP_normal.jpg"
"x1255201107074220038","x1437794618779840515",2021-09-14 15:05:24,"Nico_D98","@watch_union Gibt es noch ein Triell?","Twitter for iPhone",24,"x1437789321688403969","x859101343356772353","watch_union",FALSE,FALSE,0,0,,,,,,,,,,,,,,,,"x859101343356772353","watch_union","de",,,,,,,,,,,,,,,,,,,,,,,,,,,,,,,,,,,,,"NA NA","NA NA","NA NA NA NA NA NA NA NA","https://twitter.com/Nico_D98/status/1437794618779840515","Nico","","Jura, Politik, Besserwisser, Sport, Schlager<U+0001F37A>",,FALSE,3,36,0,297,285,2020-04-28 18:24:07,FALSE,,,,,,"http://pbs.twimg.com/profile_images/1388495582826795008/1D9GGy9w_normal.jpg"
"x1258663423795134464","x1437794617295048720",2021-09-14 15:05:24,"2020_NATURA","#Innovationstreiber: Baerbock polarisiert mutig mit Verbotsthese zu Hemmnissen wie Billigflüge, Glyphosat oder Billigfleischwerbung. 
https://t.co/9REXrB15pF","Twitter for Android",157,,,,FALSE,FALSE,0,2,,,"Innovationstreiber",,"faz.net/aktuell/wirtsc…","https://t.co/9REXrB15pF","https://www.faz.net/aktuell/wirtschaft/baerbock-im-tv-triell-koennen-verbote-innovationstreiber-sein-17535039.html",,,,,,,,,,,"de",,,,,,,,,,,,,,,,,,,,,,,,,,,,,,,,,,,,,"NA NA","NA NA","NA NA NA NA NA NA NA NA","https://twitter.com/2020_NATURA/status/1437794617295048720","FFH Natura 2000 <U+0001F1EA><U+0001F1FA> <U+25FD>","<U+0001F1EA><U+0001F1FA>  @beyond_mass_tourism","Naturschutz-Praxis des 'Bedürfnisse deckenden Standorts' genügt nicht dem Konzept der Lebensräume, EU-Interdependenz_Strategie,  Wiederherstellung von Gebieten.","https://t.co/erMXDt0F2b",FALSE,103,741,1,7782,223,2020-05-08 07:42:45,FALSE,"https://t.co/erMXDt0F2b","https://www.zdf.de/nachrichten/politik/eugh-naturschutz-eu-deutschland-100.html",,"https://pbs.twimg.com/profile_banners/1258663423795134464/1588928757",,"http://pbs.twimg.com/profile_images/1258684158043439104/Hp7psGPb_normal.jpg"
"x2270959409","x1437794551037562890",2021-09-14 15:05:08,"MWesenauer","Braking news: Nach Beschwerden der Intelligenz Wächter-nächstes Triell - RTL Konfrontation 
Baerbock, Olaf Scholz, Armin Laschet, wird von Dieter Bohlen moderiert!
Journalisten mit Politikern überfordert!","Twitter for iPad",204,,,,FALSE,FALSE,0,0,,,,,,,,,,,,,,,,,,"de",,,,,,,,,,,,,,,,,,,,,,,,,,,,,,,,,,,,,"NA NA","NA NA","NA NA NA NA NA NA NA NA","https://twitter.com/MWesenauer/status/1437794551037562890","Manfred Wesenauer","Lengau, Österreich","","https://t.co/wPl0Cdc8hm",FALSE,22,101,0,1115,60,2014-01-09 14:54:47,FALSE,"https://t.co/wPl0Cdc8hm","http://www.zurich.at",,"https://pbs.twimg.com/profile_banners/2270959409/1631026512","http://abs.twimg.com/images/themes/theme1/bg.png","http://pbs.twimg.com/profile_images/1245277147213815808/VhbZzddk_normal.jpg"
"x857609245","x1437794350394744835",2021-09-14 15:04:20,"JPProeger","Ich habe mir nun doch das Triell angesehen. Wenn wir mal die Skandale beiseite legen, bin ich angenehm von Scholz überrascht. 
Ich könnte ihn mir gut als Vizekanzler einer Grün roten Regierung vorstellen.","Twitter for iPhone",204,,,,FALSE,FALSE,8,0,,,,,,,,,,,,,,,,,,"de",,,,,,,,,,,,,,,,,,,,,,,,,,,,,,,,,,,,,"NA NA","NA NA","NA NA NA NA NA NA NA NA","https://twitter.com/JPProeger/status/1437794350394744835","Der P hat dumme Ideen im Kopf. <U+0001F33B>","Hamburg","I know what time is, Time is a thief It'll steal into bed and rob you while you sleep. Cyclist, Maker, Marketer, Engineer @Trinamic_MC he/him","https://t.co/FVtk4YTqLz",FALSE,816,1278,16,25470,84506,2012-10-02 06:52:52,FALSE,"https://t.co/FVtk4YTqLz","http://www.jonpro.de",,"https://pbs.twimg.com/profile_banners/857609245/1619956030","http://abs.twimg.com/images/themes/theme14/bg.gif","http://pbs.twimg.com/profile_images/1414570523598770178/jCfRctu-_normal.jpg"
"x370830114","x1437794257281159187",2021-09-14 15:03:58,"Max842R","#Triell  Brutto versus Netto - Leerstunde für @ZDF + @ARDde  ""Einen kleinen Vorsprung hat Frau Baerbock"". Aha. Hervorragend analysiert und dargestellt von @Ceremony64 
s. 1:06:10  im Video.
https://t.co/AfMzrS2wgp https://t.co/bqJ685gi8h","Twitter Web App",213,,,,FALSE,FALSE,0,0,,,"Triell",,"superconnected.org/triellzdf/","https://t.co/AfMzrS2wgp","https://superconnected.org/triellzdf/","http://pbs.twimg.com/media/E_QR8yDXMAUQvwq.jpg","https://t.co/bqJ685gi8h","https://twitter.com/Max842R/status/1437794257281159187/photo/1","photo","http://pbs.twimg.com/media/E_QR8yDXMAUQvwq.jpg","https://t.co/bqJ685gi8h","https://twitter.com/Max842R/status/1437794257281159187/photo/1",,"x57350105 x556842058 x2288783683","ZDF ARDde Ceremony64","de",,,,,,,,,,,,,,,,,,,,,,,,,,,,,,,,,,,,,"NA NA","NA NA","NA NA NA NA NA NA NA NA","https://twitter.com/Max842R/status/1437794257281159187","Max","","Rhythm is the answer",,FALSE,123,24,6,7905,14328,2011-09-09 18:11:08,FALSE,,,,,"http://abs.twimg.com/images/themes/theme9/bg.gif","http://pbs.twimg.com/profile_images/879685143790850050/xunFX3rp_normal.jpg"
"x1495938012","x1437793828438790151",2021-09-14 15:02:16,"wofido","Triell ohne Migration: Das Thema Nr. 1 blieb ausgeblendet https://t.co/NL1s6yFIQj via @tichyseinblick","Twitter Web App",101,,,,FALSE,FALSE,0,0,,,,,"tichyseinblick.de/kolumnen/josef…","https://t.co/NL1s6yFIQj","https://www.tichyseinblick.de/kolumnen/josef-kraus-lernen-und-bildung/triell-ohne-migration-das-thema-nr-1-blieb-ausgeblendet/",,,,,,,,,"x3172870258","TichysEinblick","de",,,,,,,,,,,,,,,,,,,,,,,,,,,,,,,,,,,,,"NA NA","NA NA","NA NA NA NA NA NA NA NA","https://twitter.com/wofido/status/1437793828438790151","wfischer","Dortmund","Jegliches hat seine Zeit       Gesammelte Netzfundstücke",,FALSE,137,115,4,22261,3243,2013-06-09 16:04:27,FALSE,,,,"https://pbs.twimg.com/profile_banners/1495938012/1629398430","http://abs.twimg.com/images/themes/theme10/bg.gif","http://pbs.twimg.com/profile_images/1412498422058397702/6H33rVgl_normal.jpg"
"x374005383","x1437793753410965505",2021-09-14 15:01:58,"GuenterList","#Triell
Tempo 130 - bei der Digitalisierung längst Realität.","Twitter for iPhone",60,,,,FALSE,FALSE,0,0,,,"Triell",,,,,,,,,,,,,,,"de",,,,,,,,,,,,,,,,,,,,,,,,,,,,,,,,,,,,,"NA NA","NA NA","NA NA NA NA NA NA NA NA","https://twitter.com/GuenterList/status/1437793753410965505","Guenter Ki","","Ich weiß es doch auch nicht. Aber so ist es auch nicht richtig! Contrarian. V.S.O.P. Humor ist die Überwindung der Verzweiflung mit heiteren Mitteln (WFinck)",,FALSE,400,365,31,41113,31034,2011-09-15 15:01:20,FALSE,,,,,"http://abs.twimg.com/images/themes/theme1/bg.png","http://pbs.twimg.com/profile_images/1170267643779198977/HkldcxU7_normal.jpg"
"x374005383","x1437791881077956618",2021-09-14 14:54:31,"GuenterList","#Triell
Die Wähler haben längst ihr Kreuz per Briefwahl gemacht. Die Kandidaten machen trotzdem weiterhin fleißig ihren Affen. Schaulaufen für die Katz","Twitter for iPhone",151,,,,FALSE,FALSE,0,0,,,"Triell",,,,,,,,,,,,,,,"de",,,,,,,,,,,,,,,,,,,,,,,,,,,,,,,,,,,,,"NA NA","NA NA","NA NA NA NA NA NA NA NA","https://twitter.com/GuenterList/status/1437791881077956618","Guenter Ki","","Ich weiß es doch auch nicht. Aber so ist es auch nicht richtig! Contrarian. V.S.O.P. Humor ist die Überwindung der Verzweiflung mit heiteren Mitteln (WFinck)",,FALSE,400,365,31,41113,31034,2011-09-15 15:01:20,FALSE,,,,,"http://abs.twimg.com/images/themes/theme1/bg.png","http://pbs.twimg.com/profile_images/1170267643779198977/HkldcxU7_normal.jpg"
"x1530663991","x1437793380138983430",2021-09-14 15:00:29,"Neulandsmann","@Lashersday Najo, die Aussage ist zwei Jahre alt.

Zwischenzeitlich hat sich viel getan, vor allem (und bislang leider nur) im Ausland.

Wäre jedenfalls eine schicke #Triell-Frage.","Twitter Web App",168,"x1437792447153721348","x1268521497053847553","Lashersday",FALSE,FALSE,2,0,,,"Triell",,,,,,,,,,,,,"x1268521497053847553","Lashersday","de",,,,,,,,,,,,,,,,,,,,,,,,,,,,,,,,,,,,,"NA NA","NA NA","NA NA NA NA NA NA NA NA","https://twitter.com/Neulandsmann/status/1437793380138983430","Faulenz der Fleißige","","Angepiekst und original verimpft von Biontech & Söhne",,FALSE,224,233,2,4449,8965,2013-06-19 11:59:20,FALSE,,,,"https://pbs.twimg.com/profile_banners/1530663991/1600832702","http://abs.twimg.com/images/themes/theme1/bg.png","http://pbs.twimg.com/profile_images/1308613315258658816/34IBQzSm_normal.jpg"
"x989963388955525121","x1437792935484051465",2021-09-14 14:58:43,"klaus_enax","@Peter_Ahrens Das einzig noch sehende Triell wäre eine Befragung der Drei durch Darsteller der Serie Berlin Tag und Nacht.","Twitter for Android",108,"x1437777440445771776","x30433808","Peter_Ahrens",FALSE,FALSE,0,0,,,,,,,,,,,,,,,,"x30433808","Peter_Ahrens","de",,,,,,,,,,,,,,,,,,,,,,,,,,,,,,,,,,,,,"NA NA","NA NA","NA NA NA NA NA NA NA NA","https://twitter.com/klaus_enax/status/1437792935484051465","Prince Kongo Otto","Nordrhein-Westfalen, Deutschla","Amtierender Weltmeister in der Fruchtfliegenzucht",,FALSE,143,466,0,9046,28702,2018-04-27 20:23:59,FALSE,,,,"https://pbs.twimg.com/profile_banners/989963388955525121/1630739954",,"http://pbs.twimg.com/profile_images/990204711600082944/jGWhWoB5_normal.jpg"
"x1366684524298526722","x1437792751098138631",2021-09-14 14:57:59,"PkmCenterBln","Das nächste Triell wird kommentiert von Frank ""Buschi"" Buschmann und Jan ""Köppi"" Köppen","Twitter Web App",87,,,,FALSE,FALSE,3,0,,,,,,,,,,,,,,,,,,"de",,,,,,,,,,,,,,,,,,,,,,,,,,,,,,,,,,,,,"NA NA","NA NA","NA NA NA NA NA NA NA NA","https://twitter.com/PkmCenterBln/status/1437792751098138631","Pokemoncenter Berlin Mitte","","Wir heilen eure Pokemon und machen sie wieder fit",,FALSE,838,190,0,1701,5669,2021-03-02 09:39:33,FALSE,,,,"https://pbs.twimg.com/profile_banners/1366684524298526722/1615447002",,"http://pbs.twimg.com/profile_images/1381953789217931268/fjn1JNjs_normal.jpg"
"x1059572000195297281","x1437792574467715072",2021-09-14 14:57:17,"Dom92531431","„Weiter so“ in der Digitalisierung (überraschender Weise ja nun eins der zwei Themen von #LaschetLuegt ) bedeutet für Deutschland weiter auf dem vorletzten Platz in Europa zu bleiben? #Triell","Twitter for iPhone",191,,,,FALSE,FALSE,0,0,,,"LaschetLuegt Triell",,,,,,,,,,,,,,,"de",,,,,,,,,,,,,,,,,,,,,,,,,,,,,,,,,,,,,"NA NA","NA NA","NA NA NA NA NA NA NA NA","https://twitter.com/Dom92531431/status/1437792574467715072","Dom","","",,FALSE,10,101,0,150,22,2018-11-05 22:23:45,FALSE,,,,,,"http://abs.twimg.com/sticky/default_profile_images/default_profile_normal.png"
"x159572795","x1437792430015885324",2021-09-14 14:56:42,"ChristineM_Sing","„Eigentlich ist es kein Triell, sondern ein Duell: Machen wir weiter so wie bisher oder kriegen wir ne Wende hin?“ Und: „Wir brauchen endlich eine funktionierende Struktur und eine handlungsfähige Digitalisierung“, so @annachristmann heute in Stuttgart. #wahl2021 https://t.co/DSgXlbJlMZ","Twitter for iPhone",263,,,,FALSE,FALSE,0,0,,,"wahl2021",,,,,"http://pbs.twimg.com/media/E_QQll7WUA4j-vS.jpg","https://t.co/DSgXlbJlMZ","https://twitter.com/ChristineM_Sing/status/1437792430015885324/photo/1","photo","http://pbs.twimg.com/media/E_QQll7WUA4j-vS.jpg","https://t.co/DSgXlbJlMZ","https://twitter.com/ChristineM_Sing/status/1437792430015885324/photo/1",,"x1617177360","annachristmann","de",,,,,,,,,,,,,,,,,,,,,,,,,,,,,,,,,,,,,"NA NA","NA NA","NA NA NA NA NA NA NA NA","https://twitter.com/ChristineM_Sing/status/1437792430015885324","Christine Sing","Esslingen am Neckar, Deutschland","<U+0001F30A> “You cannot stop the waves of life, but you can learn to surf.“ Visionary. Feminist. Surf Guide. <U+0001F3C4><U+0001F3FD><U+200D><U+2640><U+FE0F> Dedicated to more diversity & humanity.","https://t.co/mJXr1eR15d",FALSE,970,991,10,1296,10052,2010-06-25 19:19:49,FALSE,"https://t.co/mJXr1eR15d","http://www.christine-sing.de",,"https://pbs.twimg.com/profile_banners/159572795/1614521921","http://abs.twimg.com/images/themes/theme1/bg.png","http://pbs.twimg.com/profile_images/1366030557344325632/JZmpFpVv_normal.jpg"
